{
  "name": "gateway-example",
  "description": "Example Anthropic-compatible gateway - edit or copy this file",
  "base_url": "https://gateway.example.com/anthropic",
  "auth": {
    "type": "credman",
    "target": "claude-provider/gateway-example"
  },
  "model": "provider/model-name",
  "ttl_ms": 300000,
  "extras": {
    "CLAUDE_CODE_MAX_OUTPUT_TOKENS": "64000"
  }
}
